title,author,link,image
Phones and social media turn consumers into whistleblowers,Philippine Daily Inquirer,http://technology.inquirer.net/61322/phones-social-media-turn-consumers-whistleblowers,NULL
Astronomers piece together first image of black hole,Philippine Daily Inquirer,http://technology.inquirer.net/61318/astronomers-piece-together-first-image-black-hole,NULL
"Offices, homes told to secure data systems",Philippine Daily Inquirer,http://technology.inquirer.net/61313/offices-homes-told-secure-data-systems,NULL
,Philippine Daily Inquirer,,NULL
"Collective wisdom, collective stupidity",Philippine Daily Inquirer,http://opinion.inquirer.net/103191/collective-wisdom-collective-stupidity,NULL
Victory but also concern,Philippine Daily Inquirer,http://opinion.inquirer.net/103186/victory-also-concern,NULL
No name for her pain,Philippine Daily Inquirer,http://opinion.inquirer.net/103183/no-name-pain,NULL
Holy Week’s pilgrimage of tourists,Philippine Daily Inquirer,http://opinion.inquirer.net/103180/holy-weeks-pilgrimage-tourists,NULL
Redefining barangay in new charter,Philippine Daily Inquirer,http://opinion.inquirer.net/103178/redefining-barangay-new-charter,NULL
Mekong rice,Philippine Daily Inquirer,http://opinion.inquirer.net/103176/mekong-rice,NULL
Why be good?,Philippine Daily Inquirer,http://opinion.inquirer.net/103174/why-be-good,NULL
College and mental health,Philippine Daily Inquirer,http://opinion.inquirer.net/103172/college-mental-health,NULL
The next revolution,Philippine Daily Inquirer,http://opinion.inquirer.net/103170/the-next-revolution,NULL
,Philippine Daily Inquirer,,NULL
"Bahrain prefers Filipino workers, seeks faster deployment by PH",Philippine Daily Inquirer,http://globalnation.inquirer.net/154894/bahrain-prefers-filipino-workers-seeks-faster-deployment-ph,NULL
Suspected IS member deported to Kuwait,Philippine Daily Inquirer,http://globalnation.inquirer.net/154891/suspected-is-member-deported-to-kuwait,NULL
"Duterte, Bahraini king oversee signing of 4 deals",Philippine Daily Inquirer,http://globalnation.inquirer.net/154888/duterte-bahraini-king-oversee-signing-4-deals,NULL
Filipino convicted of spying in Qatar spared from gallows,Philippine Daily Inquirer,http://globalnation.inquirer.net/154884/filipino-convicted-of-spying-in-qatar-spared-from-gallows,NULL
PH brings home 91 repatriated Filipinos from Saudi,Philippine Daily Inquirer,http://globalnation.inquirer.net/154869/ph-brings-home-91-repatriated-filipinos-saudi,NULL
"Duterte: Congressional action needed for OFW dept, nat’l ID system",Philippine Daily Inquirer,http://globalnation.inquirer.net/154867/duterte-congressional-action-needed-ofw-dept-natl-id-system,NULL
"France, New Zealand issue travel advisories on parts of PH",Philippine Daily Inquirer,http://globalnation.inquirer.net/154862/france-new-zealand-issue-travel-advisories-on-parts-of-ph,NULL
"Filipina, 94, also a ‘victim’ of United Airlines ‘discrimination’",Philippine Daily Inquirer,http://globalnation.inquirer.net/154852/filipina-94-also-victim-united-airlines-discrimination,NULL
Imee Marcos says she visited Ilocano OFWs in Mideast trip,Philippine Daily Inquirer,http://globalnation.inquirer.net/154849/imee-marcos-says-checked-ilocano-ofws-mideast-trip,NULL
,Philippine Daily Inquirer,,NULL
First elected Fil-Am judge in Illinois indicted for mortgage fraud,Philippine Daily Inquirer,http://usa.inquirer.net/2876/chicago-area-fil-judge-indicted-mortgage-fraud-charges,NULL
United’s Unfriendly Skies: TWA (Traveling While Asian) is no joke,Philippine Daily Inquirer,http://usa.inquirer.net/2856/uniteds-unfriendly-skies-twa-traveling-asian-no-joke,NULL
San Francisco remembers Bataan at jubilant Presidio rites,Philippine Daily Inquirer,http://usa.inquirer.net/2863/san-francisco-remembers-bataan-jubilant-presidio-rites,NULL
Wesley So is the new US chess champion,Philippine Daily Inquirer,http://usa.inquirer.net/2859/wesley-new-us-chess-champion,NULL
"PAL and DOT in San Francisco promote new destinations, travel features",Philippine Daily Inquirer,http://usa.inquirer.net/2872/pal-dot-san-francisco-promote-new-destinations-travel-features,NULL
"Filipino food, kapre, etc. in Toronto kids’ play ‘Kaldero’",Philippine Daily Inquirer,http://usa.inquirer.net/2841/filipino-food-kapre-tiyanak-etc-toronto-kids-play-kaldero,NULL
Arkipelago Books – SF’s Filipino cultural mecca passes the torch,Philippine Daily Inquirer,http://usa.inquirer.net/2850/arkipelago-books-sfs-filipino-cultural-mecca-passes-torch,NULL
United Airlines Ejection: On being a ‘randomly picked’ Asian,Philippine Daily Inquirer,http://usa.inquirer.net/2847/united-airlines-ejection-randomly-picked-asian,NULL
H-1B visa quota for 2018 filled in less than a week,Philippine Daily Inquirer,http://usa.inquirer.net/2843/h-1b-visa-quota-2018-filled-less-week,NULL
"Anti-Duterte or not, Catholics join ‘Penitential Walk for Life’",Philippine Daily Inquirer,http://newsinfo.inquirer.net/889171/anti-duterte-or-not-catholics-join-penitential-walk-for-life,NULL
Filipinos re-enact Christ’s crucifixion in gory spectacle,Philippine Daily Inquirer,http://newsinfo.inquirer.net/889175/filipinos-re-enact-christs-crucifixion-in-gory-spectacle,NULL
CPP says US involved in Abu Sayyaf attack in Bohol,Philippine Daily Inquirer,http://newsinfo.inquirer.net/889162/cpp-says-us-involved-in-abu-sayyaf-attack-in-bohol,NULL
Filipino convicted of spying in Qatar spared from gallows,Philippine Daily Inquirer,http://globalnation.inquirer.net/154884/filipino-convicted-of-spying-in-qatar-spared-from-gallows,NULL
Suspected IS member deported to Kuwait,Philippine Daily Inquirer,http://globalnation.inquirer.net/154891/suspected-is-member-deported-to-kuwait,NULL
"Are your homes, business establishments quake-proof?",Philippine Daily Inquirer,http://newsinfo.inquirer.net/889110/are-your-homes-business-establishments-quake-proof,NULL
Nowitzki confirms return for 20th season,Philippine Daily Inquirer,http://sports.inquirer.net/244758/nowitzki-confirms-return-20th-season,NULL
Tagle tells public: Fight culture of death with culture of love,Philippine Daily Inquirer,http://newsinfo.inquirer.net/889117/tagle-tells-public-fight-culture-of-death-with-culture-of-love,NULL
US ‘Mother Of All Bombs’ kills dozen of IS militants—Afghan execs,Philippine Daily Inquirer,http://newsinfo.inquirer.net/889126/us-mother-of-all-bombs-kills-dozen-of-is-militants-afghan-execs,NULL
"5 men nailed to crosses in Pampanga city, 9 more to go",Philippine Daily Inquirer,http://newsinfo.inquirer.net/889114/5-men-nailed-to-crosses-in-pampanga-city-9-more-to-go,NULL
